{
  "$schema": "https://json-schema.org/draft/2020-12/schema",
  "$id": "https://inkcraft.local/schemas/studio-status.schema.json",
  "title": "StudioJobStatus",
  "type": "object",
  "additionalProperties": false,
  "properties": {
    "jobId": {
      "type": "string",
      "pattern": "^[a-f0-9]{32}$"
    },
    "state": {
      "type": "string",
      "enum": [
        "queued",
        "running",
        "succeeded",
        "failed",
        "cancelled"
      ]
    },
    "result": {
      "anyOf": [
        {
          "$ref": "#/$defs/artifact"
        },
        {
          "type": "null"
        }
      ]
    },
    "error": {
      "type": [
        "string",
        "null"
      ]
    },
    "stage": {
      "description": "TASK-0076 (audit UX-03): the pipeline step a running job is in, as the worker reports it. Absent when unknown.",
      "type": "string",
      "enum": [
        "references",
        "skin",
        "drawing",
        "stencil",
        "placing",
        "finishing"
      ]
    },
    "queuePosition": {
      "description": "TASK-0076: for a queued job, how many jobs (including it) are ahead in the studio's queue.",
      "type": "integer",
      "minimum": 1
    }
  },
  "required": [
    "jobId",
    "state",
    "result",
    "error"
  ],
  "$defs": {
    "asset": {
      "type": "object",
      "additionalProperties": false,
      "properties": {
        "assetId": {
          "type": "string",
          "pattern": "^[a-f0-9]{32}$"
        },
        "designId": {
          "type": "string",
          "pattern": "^[a-f0-9]{64}$"
        },
        "mimeType": {
          "type": "string",
          "enum": [
            "image/png",
            "image/svg+xml",
            "application/pdf"
          ]
        }
      },
      "required": [
        "assetId",
        "designId",
        "mimeType"
      ],
      "title": "StudioAsset"
    },
    "artifact": {
      "type": "object",
      "additionalProperties": false,
      "properties": {
        "designId": {
          "type": "string",
          "pattern": "^[a-f0-9]{64}$"
        },
        "briefId": {
          "type": "string",
          "pattern": "^[a-f0-9-]{36}$"
        },
        "briefRevision": {
          "type": "integer",
          "minimum": 1
        },
        "size": {
          "type": "object",
          "additionalProperties": false,
          "properties": {
            "widthMm": {
              "type": "number",
              "minimum": 5,
              "maximum": 600
            },
            "heightMm": {
              "type": "number",
              "minimum": 5,
              "maximum": 600
            }
          },
          "required": [
            "widthMm",
            "heightMm"
          ]
        },
        "master": {
          "$ref": "#/$defs/asset"
        },
        "stencil": {
          "$ref": "#/$defs/asset"
        },
        "stencilMirror": {
          "$ref": "#/$defs/asset"
        },
        "pdf": {
          "$ref": "#/$defs/asset"
        },
        "pdfMirror": {
          "$ref": "#/$defs/asset"
        },
        "mockup": {
          "$ref": "#/$defs/asset"
        },
        "referenceAnalysis": {
          "type": "string",
          "minLength": 1,
          "maxLength": 3000
        },
        "reviewRequired": {
          "const": true
        },
        "backgroundKind": {
          "type": "string",
          "enum": [
            "own_photo",
            "generated_anatomy"
          ]
        },
        "transform": {
          "type": "object",
          "additionalProperties": false,
          "properties": {
            "xPx": {
              "type": "integer",
              "minimum": 0
            },
            "yPx": {
              "type": "integer",
              "minimum": 0
            },
            "widthPx": {
              "type": "integer",
              "minimum": 0
            },
            "heightPx": {
              "type": "integer",
              "minimum": 0
            },
            "method": {
              "enum": [
                "geometric-multiply",
                "fresh-ink-composite"
              ]
            },
            "curvature": {
              "type": "number",
              "minimum": 0,
              "maximum": 1.2,
              "description": "Approximate cylindrical warp in radians, not inferred anatomy."
            },
            "taper": {
              "type": "number",
              "minimum": 0,
              "maximum": 0.35,
              "description": "Illustrative narrowing towards the lower calf, not measured anatomy."
            },
            "scaleCalibrated": {
              "type": "boolean"
            },
            "generativePostprocess": {
              "type": "boolean",
              "description": "True only when a constrained AI finish replaced the geometric composite after passing the geometry check against it (ADR-0016, ADR-0018). The stencil never derives from it."
            },
            "finish": {
              "enum": [
                "accepted",
                "declined",
                "unavailable",
                "rejected_geometry",
                "rejected_output"
              ],
              "description": "What happened to the AI finish when one was attempted (ADR-0018). Anything but accepted means the geometric composite was delivered."
            },
            "bodyFit": {
              "type": "object",
              "additionalProperties": false,
              "required": [
                "scale",
                "spill",
                "taper"
              ],
              "description": "How the design was fitted to the body silhouette read from the photograph (TASK-0039). A silhouette, not depth.",
              "properties": {
                "scale": {
                  "type": "number",
                  "exclusiveMinimum": 0,
                  "maximum": 1
                },
                "spill": {
                  "type": "number",
                  "minimum": 0,
                  "maximum": 1
                },
                "taper": {
                  "type": "number",
                  "minimum": 0,
                  "maximum": 0.35
                }
              }
            },
            "sourceCropPx": {
              "type": "object",
              "additionalProperties": false,
              "required": [
                "left",
                "top",
                "width",
                "height"
              ],
              "properties": {
                "left": {
                  "type": "integer",
                  "minimum": 0
                },
                "top": {
                  "type": "integer",
                  "minimum": 0
                },
                "width": {
                  "type": "integer",
                  "minimum": 1
                },
                "height": {
                  "type": "integer",
                  "minimum": 1
                }
              }
            },
            "surface": {
              "type": "number",
              "minimum": 0,
              "maximum": 1,
              "description": "How strongly the ink is attenuated where the photograph's own shading says the body turns away. An illustrative approximation of surface form, not recovered depth, and never a displacement: the artwork's geometry is authoritative (ADR-0014, MOCKUP-INV-001)."
            },
            "freshness": {
              "type": "number",
              "minimum": 0,
              "maximum": 4,
              "description": "Strength of the fresh-ink reddening around the strokes. 0 when the render is a plain multiply. Illustrative, never a clinical prediction of healing (PROD-INV-003)."
            }
          },
          "required": [
            "xPx",
            "yPx",
            "widthPx",
            "heightPx",
            "method",
            "scaleCalibrated",
            "generativePostprocess"
          ],
          "if": {
            "properties": {
              "generativePostprocess": {
                "const": true
              }
            },
            "required": [
              "generativePostprocess"
            ]
          },
          "then": {
            "required": [
              "finish"
            ],
            "properties": {
              "finish": {
                "const": "accepted"
              }
            }
          }
        },
        "notice": {
          "type": "string",
          "minLength": 1
        },
        "stencilReview": {
          "description": "TASK-0086 (audit ARQ-03): how the stencil was obtained, so the client and the tattooer know how far to trust it. `lineart`: traced from a dedicated line-art pass; `colour_contours`: approximate contours of a colour or shaded design. `simplification`: 0 when traced at full detail, 1 to 3 for each coarser pass needed.",
          "type": "object",
          "additionalProperties": false,
          "required": [
            "method",
            "simplification"
          ],
          "properties": {
            "method": {
              "type": "string",
              "enum": [
                "lineart",
                "colour_contours"
              ]
            },
            "simplification": {
              "type": "integer",
              "minimum": 0,
              "maximum": 3
            }
          }
        },
        "background": {
          "$ref": "#/$defs/asset"
        },
        "capture": {
          "type": "object",
          "additionalProperties": false,
          "required": [
            "parentJobId",
            "photo"
          ],
          "description": "A photograph the client took with the camera try-on and chose to keep, saved as a version of the design it shows (ADR-0022). Every other field is the parent's: the design is unchanged. The photograph passed the own-photo gate and is never sent to an image model.",
          "properties": {
            "parentJobId": {
              "type": "string",
              "pattern": "^[a-f0-9]{32}$"
            },
            "photo": {
              "type": "object",
              "additionalProperties": false,
              "required": [
                "assetId",
                "designId",
                "mimeType"
              ],
              "description": "Stored as the media store keeps every own-body photograph: JPEG, EXIF stripped, encrypted at rest.",
              "properties": {
                "assetId": {
                  "type": "string",
                  "pattern": "^[a-f0-9]{32}$"
                },
                "designId": {
                  "type": "string",
                  "pattern": "^[a-f0-9]{64}$"
                },
                "mimeType": {
                  "type": "string",
                  "enum": [
                    "image/jpeg",
                    "image/png"
                  ]
                }
              }
            }
          }
        },
        "edit": {
          "type": "object",
          "additionalProperties": false,
          "required": [
            "parentJobId",
            "instruction"
          ],
          "properties": {
            "parentJobId": {
              "type": "string",
              "pattern": "^[a-f0-9]{32}$"
            },
            "instruction": {
              "type": "string",
              "minLength": 3,
              "maxLength": 1000
            },
            "referenceIds": {
              "type": "array",
              "minItems": 1,
              "maxItems": 3,
              "uniqueItems": true,
              "items": {
                "type": "string",
                "pattern": "^[a-f0-9]{32}$"
              }
            },
            "coverage": {
              "enum": [
                "larger",
                "smaller",
                "full"
              ]
            },
            "mode": {
              "enum": [
                "artwork",
                "placement"
              ]
            }
          }
        }
      },
      "required": [
        "designId",
        "briefId",
        "briefRevision",
        "size",
        "master",
        "stencil",
        "stencilMirror",
        "pdf",
        "pdfMirror",
        "mockup",
        "referenceAnalysis",
        "reviewRequired",
        "backgroundKind",
        "transform",
        "notice"
      ],
      "title": "GeneratedTattooArtifact"
    }
  },
  "allOf": [
    {
      "if": {
        "properties": {
          "state": {
            "const": "succeeded"
          }
        }
      },
      "then": {
        "properties": {
          "result": {
            "$ref": "#/$defs/artifact"
          },
          "error": {
            "type": "null"
          }
        }
      },
      "else": {
        "properties": {
          "result": {
            "type": "null"
          }
        }
      }
    },
    {
      "if": {
        "properties": {
          "state": {
            "const": "failed"
          }
        }
      },
      "then": {
        "properties": {
          "error": {
            "type": "string",
            "minLength": 1
          }
        }
      }
    }
  ]
}
